{
  "schema": "openauthor.mobile.snapshot.envelope",
  "schema_version": 1,
  "project_id": "project_glass_harbor",
  "project_revision": "rev_7e3c1a",
  "snapshot_id": "snapshot_glass_harbor_7e3c1a",
  "manifest_sha256": "sha256:9999999999999999999999999999999999999999999999999999999999999999",
  "published_at": "2026-08-30T15:01:00.000Z",
  "manifest": {
    "schema": "openauthor.mobile.snapshot.manifest",
    "schema_version": 1,
    "project_id": "project_glass_harbor",
    "revision": "rev_7e3c1a",
    "content_sha256": "6666666666666666666666666666666666666666666666666666666666666666",
    "byte_length": 48192
  },
  "blob": {
    "schema": "openauthor.mobile.snapshot.blob",
    "schema_version": 1,
    "snapshot_id": "snapshot_glass_harbor_7e3c1a",
    "project_id": "project_glass_harbor",
    "project_revision": "rev_7e3c1a",
    "object_bucket": "mobile-encrypted-sync",
    "object_key": "projects/project_glass_harbor/snapshots/snapshot_glass_harbor_7e3c1a.bin",
    "content_type": "text/plain;charset=utf-8",
    "encryption": {
      "algorithm": "aes-256-gcm-v1",
      "project_key_version": 4,
      "aad_version": 1
    },
    "ciphertext_sha256": "8888888888888888888888888888888888888888888888888888888888888888",
    "ciphertext_byte_length": 48208
  }
}
